{
  "$schema": "https://json-schema.org/draft/2020-12/schema",
  "$id": "https://braid.dev/dsl/v1.json",
  "title": "braid workflow DSL v1.0",
  "description": "braid 工作流定义 DSL。结构合法性归本 Schema;语义校验由 T1.2 解析器实现:环检测、悬空引用、引用类型、引用必须是祖先节点、inputs/user_data/节点 id 重名检测、branch 出边集合与 cases[].next ∪ {default} 目标一致、发布时工具白名单。引用位置规则:纯引用位置(workflow outputs、branch.when.left、user_data.ref)必须是单一引用;tool.inputs 的值内允许嵌入式 {{inputs.*}} 引用。tool.inputs 的键名黑名单与 URL/IPv4 值禁令只是启发式第一网,权威门禁 = 发布时按工具 input schema 校验(T5.4)+ 运行时 Dialer.Control(T3.3)。",
  "type": "object",
  "additionalProperties": false,
  "required": ["dsl", "name", "nodes"],
  "properties": {
    "$comment": { "type": "string", "maxLength": 2000 },
    "dsl": {
      "const": "1.0",
      "description": "DSL 语法版本。与 workflow 定义版本(workflow_definitions 表)是两回事。"
    },
    "name": {
      "type": "string",
      "pattern": "^[a-z][a-z0-9-]{1,63}$"
    },
    "description": {
      "type": "string",
      "maxLength": 2000
    },
    "metadata": {
      "type": "object",
      "additionalProperties": false,
      "properties": {
        "canvas": {
          "type": "object",
          "additionalProperties": false,
          "description": "画布元数据预留(P1 画布直接消费,引擎忽略)。",
          "properties": {
            "nodes": {
              "type": "object",
              "maxProperties": 512,
              "propertyNames": { "$ref": "#/$defs/identifier" },
              "additionalProperties": {
                "type": "object",
                "additionalProperties": false,
                "required": ["position"],
                "properties": {
                  "position": { "$ref": "#/$defs/point" }
                }
              }
            },
            "viewport": {
              "type": "object",
              "additionalProperties": false,
              "required": ["x", "y", "zoom"],
              "properties": {
                "x": { "type": "number" },
                "y": { "type": "number" },
                "zoom": { "type": "number", "minimum": 0.1, "maximum": 4 }
              }
            },
            "edges": {
              "type": "array",
              "maxItems": 512,
              "description": "画布连线锚点绑定(引擎忽略,与 nodes/viewport 同层)。每条记录以 (from,to) 标识顶层 edges 的一条 —— 边唯一性由 T1.2 语义校验保证(IssueDuplicateEdge),故二元组即身份;source_anchor 指 from 节点的源锚点。锚点集合不由本层声明,而是按节点语义推导(branch = 每条 case 一个 case_<i> + default),本层只持久化「哪条边接在哪个锚点上」。**记录在场即表态**:省略 source_anchor = 作者显式把该边落在节点的缺省/兜底手柄上(导入时不做语义推导,否则显式解绑重开就被改回去);整个 (from,to) 无记录 = 从未表态,导入时按 cases[].next/default 推导(老文档开箱即有锚点连线);记录里的锚点已不存在 = 悬空,退回推导。**已知边界**:case_<i> 下标对齐 cases 数组序,cases 增删/重排后既有绑定按新下标解释(不做自动迁移);锚点整个消失时画布侧清掉绑定(边回退兜底手柄),不写悬空记录。画布导出时全表重写;未知锚点/悬空记录不承载语义(引擎忽略,画布导入时丢弃)。",
              "items": {
                "type": "object",
                "additionalProperties": false,
                "required": ["from", "to"],
                "properties": {
                  "from": { "$ref": "#/$defs/identifier" },
                  "to": { "$ref": "#/$defs/identifier" },
                  "source_anchor": { "$ref": "#/$defs/sourceAnchor" }
                }
              }
            }
          }
        }
      }
    },
    "inputs": {
      "type": "array",
      "maxItems": 64,
      "description": "工作流触发参数声明。触发值属不可信数据:在 prompt 中只能经 user_data 进入;可在 branch.when.left 与 tool.inputs 值中直接引用。",
      "items": {
        "type": "object",
        "additionalProperties": false,
        "required": ["name", "type"],
        "properties": {
          "name": { "$ref": "#/$defs/identifier" },
          "type": { "enum": ["string", "number", "boolean", "object", "array"] },
          "required": { "type": "boolean", "default": false },
          "description": { "type": "string", "maxLength": 500 }
        }
      }
    },
    "edges": {
      "type": "array",
      "maxItems": 512,
      "description": "控制流边。from/to 指向的节点存在性与 branch 路由一致性由 T1.2 校验。",
      "items": {
        "type": "object",
        "additionalProperties": false,
        "required": ["from", "to"],
        "properties": {
          "from": { "$ref": "#/$defs/identifier" },
          "to": { "$ref": "#/$defs/identifier" },
          "label": { "type": "string", "maxLength": 100 }
        }
      }
    },
    "nodes": {
      "type": "array",
      "minItems": 1,
      "maxItems": 512,
      "items": { "$ref": "#/$defs/node" }
    },
    "outputs": {
      "type": "object",
      "maxProperties": 128,
      "description": "工作流级输出:name → 纯引用。",
      "propertyNames": { "$ref": "#/$defs/identifier" },
      "additionalProperties": { "$ref": "#/$defs/reference" }
    }
  },
  "$defs": {
    "identifier": {
      "type": "string",
      "pattern": "^[a-z][a-z0-9_]{0,63}$"
    },
    "sourceAnchor": {
      "type": "string",
      "pattern": "^(case_[0-9]{1,3}|default)$",
      "description": "画布源锚点词域(branch 专有,见 metadata.canvas.edges):case_<i> 下标对齐 cases 数组序,default = 默认去向。词域在此钉死 = 跨语言合同面 —— 前端镜像见 web/canvas/src/model/dsl.ts,画布导出 fixtures 经本 Schema 校验(internal/api/canvas_contract_test.go);下标上限给 (cases.maxItems=64) 留余量。"
    },
    "reference": {
      "oneOf": [
        { "$ref": "#/$defs/inputRef" },
        { "$ref": "#/$defs/nodeRef" },
        { "$ref": "#/$defs/itemRef" }
      ],
      "description": "纯引用位置(workflow outputs、branch.when.left、user_data.ref)必须整体是一个引用,形态钉死:{{inputs.<name>}} / {{nodes.<id>.output.<field>}} / {{item[.<field>]}}。item 形态仅 parallel body 语境合法,语境闸在 T1.2 语义校验。"
    },
    "inputRef": {
      "type": "string",
      "pattern": "^\\{\\{inputs\\.[a-z][a-z0-9_]{0,63}\\}\\}$"
    },
    "nodeRef": {
      "type": "string",
      "pattern": "^\\{\\{nodes\\.[a-z][a-z0-9_]{0,63}\\.output\\.[a-z][a-z0-9_]{0,63}\\}\\}$"
    },
    "point": {
      "type": "object",
      "additionalProperties": false,
      "required": ["x", "y"],
      "properties": {
        "x": { "type": "number" },
        "y": { "type": "number" }
      }
    },
    "retry": {
      "type": "object",
      "additionalProperties": false,
      "required": ["max_attempts"],
      "properties": {
        "max_attempts": { "type": "integer", "minimum": 1, "maximum": 10 }
      }
    },
    "nodeOutputs": {
      "type": "object",
      "maxProperties": 128,
      "description": "节点输出声明:name → 类型。供 T1.2 引用类型校验与审计快照。",
      "propertyNames": { "$ref": "#/$defs/identifier" },
      "additionalProperties": { "enum": ["string", "number", "boolean", "object", "array"] }
    },
    "node": {
      "oneOf": [
        { "$ref": "#/$defs/llmNode" },
        { "$ref": "#/$defs/toolNode" },
        { "$ref": "#/$defs/branchNode" },
        { "$ref": "#/$defs/approvalNode" },
        { "$ref": "#/$defs/parallelNode" }
      ]
    },
    "llmNode": {
      "type": "object",
      "additionalProperties": false,
      "required": ["id", "type", "prompt"],
      "properties": {
        "id": { "$ref": "#/$defs/identifier" },
        "type": { "const": "llm" },
        "title": { "type": "string", "maxLength": 200 },
        "description": { "type": "string", "maxLength": 2000 },
        "retry": { "$ref": "#/$defs/retry" },
        "model": { "type": "string", "minLength": 1, "maxLength": 100 },
        "temperature": { "type": "number", "minimum": 0, "maximum": 2 },
        "max_tokens": { "type": "integer", "minimum": 1, "maximum": 200000 },
        "response_format": { "enum": ["text", "json"] },
        "prompt": { "$ref": "#/$defs/prompt" },
        "outputs": { "$ref": "#/$defs/nodeOutputs" }
      }
    },
    "prompt": {
      "type": "object",
      "additionalProperties": false,
      "required": ["template"],
      "description": "指令与数据强制分离:system/template 是受信作者指令,禁止出现 {{...}}(结构层已拦);运行时将各 user_data 项以『<name>: 渲染值』标签块追加在 template 之后(追加式,无占位符语法)。{{inputs.*}} 等不可信数据只能经 user_data 进入(间接注入缓解)。",
      "properties": {
        "system": {
          "type": "string",
          "maxLength": 8000,
          "not": { "pattern": "\\{\\{" }
        },
        "template": {
          "type": "string",
          "minLength": 1,
          "maxLength": 16000,
          "not": { "pattern": "\\{\\{" }
        },
        "user_data": {
          "type": "array",
          "maxItems": 64,
          "items": {
            "type": "object",
            "additionalProperties": false,
            "required": ["name", "ref"],
            "properties": {
              "name": { "$ref": "#/$defs/identifier" },
              "ref": { "$ref": "#/$defs/reference" }
            }
          }
        }
      }
    },
    "toolNode": {
      "type": "object",
      "additionalProperties": false,
      "required": ["id", "type", "tool", "inputs"],
      "properties": {
        "id": { "$ref": "#/$defs/identifier" },
        "type": { "const": "tool" },
        "title": { "type": "string", "maxLength": 200 },
        "description": { "type": "string", "maxLength": 2000 },
        "retry": { "$ref": "#/$defs/retry" },
        "tool": {
          "type": "string",
          "pattern": "^[a-z][a-z0-9_]{0,63}$",
          "description": "已注册工具名;是否在白名单内由发布时校验(T1.2/T5.4)。"
        },
        "inputs": {
          "type": "object",
          "maxProperties": 64,
          "description": "网络位置(host 等)由服务端白名单配置提供,禁止在 DSL 声明:键名黑名单(大小写不敏感、递归生效)与 URL/IPv4 值形态禁令是启发式第一网;权威门禁 = 发布时工具 input schema 校验 + 运行时 Dialer.Control。",
          "propertyNames": { "$ref": "#/$defs/notNetworkKey" },
          "additionalProperties": { "$ref": "#/$defs/toolInputValue" }
        },
        "outputs": { "$ref": "#/$defs/nodeOutputs" }
      }
    },
    "notNetworkKey": {
      "not": {
        "anyOf": [
          { "enum": ["host", "hostname", "url", "uri", "endpoint", "addr", "address", "server", "domain", "ip", "port", "base_url", "baseUrl", "baseurl", "hostport", "origin", "authority", "netloc", "proxy", "socket"] },
          { "pattern": "(?i)^(base|host|remote|server|target|upstream|callback|webhook|connect|redirect)[_-]?(url|uri|host|addr|address|endpoint|domain|port|name|location)" },
          { "pattern": "(?i)(host|url|uri|addr|address|endpoint|domain|server)$" }
        ]
      }
    },
    "toolInputValue": {
      "description": "tool.inputs 的值(递归):任意深度的键名都禁网络位置词;字符串值禁 URL scheme 与裸 IPv4 形态。",
      "anyOf": [
        { "type": ["number", "boolean", "null"] },
        {
          "type": "string",
          "maxLength": 65536,
          "not": {
            "anyOf": [
              { "pattern": "(?i)[a-z][a-z0-9+.\\-]*://" },
              { "pattern": "\\d{1,3}(\\.\\d{1,3}){3}" }
            ]
          }
        },
        { "type": "array", "maxItems": 256, "items": { "$ref": "#/$defs/toolInputValue" } },
        { "type": "object", "maxProperties": 64, "propertyNames": { "$ref": "#/$defs/notNetworkKey" }, "additionalProperties": { "$ref": "#/$defs/toolInputValue" } }
      ]
    },
    "branchNode": {
      "type": "object",
      "additionalProperties": false,
      "required": ["id", "type", "cases", "default"],
      "properties": {
        "id": { "$ref": "#/$defs/identifier" },
        "type": { "const": "branch" },
        "title": { "type": "string", "maxLength": 200 },
        "description": { "type": "string", "maxLength": 2000 },
        "cases": {
          "type": "array",
          "minItems": 1,
          "maxItems": 64,
          "items": {
            "type": "object",
            "additionalProperties": false,
            "required": ["when", "next"],
            "properties": {
              "when": {
                "type": "object",
                "additionalProperties": false,
                "required": ["left", "op"],
                "properties": {
                  "left": { "$ref": "#/$defs/reference" },
                  "op": { "enum": ["eq", "ne", "gt", "gte", "lt", "lte", "contains", "exists"] },
                  "right": {
                    "description": "任意字面量或引用字符串;类型匹配由 T1.2 校验。",
                    "maxLength": 4096
                  }
                }
              },
              "next": { "$ref": "#/$defs/identifier" }
            }
          }
        },
        "default": { "$ref": "#/$defs/identifier" }
      }
    },
    "approvalNode": {
      "type": "object",
      "additionalProperties": false,
      "required": ["id", "type", "approvers"],
      "properties": {
        "id": { "$ref": "#/$defs/identifier" },
        "type": { "const": "approval" },
        "title": { "type": "string", "maxLength": 200 },
        "description": { "type": "string", "maxLength": 2000 },
        "approvers": {
          "type": "array",
          "minItems": 1,
          "maxItems": 64,
          "uniqueItems": true,
          "items": { "type": "string", "pattern": "^\\S+$", "minLength": 1, "maxLength": 128, "description": "词域对齐 username(^[a-z][a-z0-9_-]{0,127}$,T4.4 语义校验拒域外);长度界 128 = users.username VARCHAR(128) 同值域。uniqueItems(T14.2):会签定局判据 = APPROVED 票数==名单长度,重复名单在该判据下永久挂起死锁;any 下重复亦是作者错误,发布期统一拒绝" }
        },
        "mode": { "enum": ["any", "all"], "default": "any", "description": "any=或签,任一票定局;all=会签,全部批准才过、任一驳回即败(T14.2)。部分批准为可见中间态(pending_approvers 读面)。" },
        "timeout_hours": { "type": "number", "minimum": 0.1, "maximum": 2160, "default": 72, "description": "缺省 72h;平台级默认可配(Q9,T4.3)。" },
        "on_timeout": { "enum": ["escalate", "fail"], "default": "escalate", "description": "escalate=升级通知并保持等待;fail=显式失败。永不自动通过。" },
        "instructions": { "type": "string", "maxLength": 4000 },
        "outputs": { "$ref": "#/$defs/nodeOutputs" }
      }
    },
    "parallelNode": {
      "type": "object",
      "additionalProperties": false,
      "required": ["id", "type", "parallel"],
      "description": "并行节点(T9.1 Scatter-Gather,D-2026-09-28-t91):foreach 集合展开 fan-out + gather 汇聚。节点无 retry(控制器不产生 attempt;实例重试由 body.retry 承载);输出契约固定 results:array(body 输出对象、输入序),不可声明。",
      "properties": {
        "id": { "$ref": "#/$defs/identifier" },
        "type": { "const": "parallel" },
        "title": { "type": "string", "maxLength": 200 },
        "description": { "type": "string", "maxLength": 2000 },
        "parallel": {
          "type": "object",
          "additionalProperties": false,
          "required": ["foreach", "body"],
          "properties": {
            "foreach": { "anyOf": [{ "$ref": "#/$defs/inputRef" }, { "$ref": "#/$defs/nodeRef" }], "description": "纯引用,二形态(T19.2,D-2026-10-05-t192):{{inputs.<name>}} 声明 type=array(T9.1,实例数触发时已知,Instantiate 预落实例行);{{nodes.<id>.output.<field>}} 祖先节点声明 type=array 的输出字段(T19.2 动态扇出,实例数派发位才知,实例行 dispatch-time 展开)。语义裁决(祖先/非 branch/array)在 T1.2 语义校验。" },
            "on_failure": { "enum": ["fail_fast", "wait_all"], "default": "fail_fast", "description": "fail_fast=任一实例终败即收敛(既有全局语义);wait_all=全部实例终态后再判。两值下执行终态同为 FAILED,差异仅收敛时机。" },
            "min_success": { "type": "integer", "minimum": 1, "description": "部分容忍阈值(T19.1,D-2026-10-05-t191)。缺省 = 未启用(禁用语义钉「字段不在」,显式 0 被 minimum 拒);[1,实例数] = 启用;input 来源超实例数由 Instantiate 拒,node 来源(T19.2 foreach 引节点输出)实例数派发位才知、越界在派发位拒(执行级 input_eval,同语义词 parallel_min_success_limit)。启用 ⇒ 成功数达标即/收齐后控制器可 SUCCEEDED(与 on_failure 正交:fail_fast+min_success=达标即收敛+不可能达标即早败;wait_all+min_success=收齐再判),gather 恒物化伴生键 failed_count,失败/在飞实例位 results=null 占位(输入序)。" },
            "body": { "$ref": "#/$defs/parallelBody" }
          }
        }
      }
    },
    "parallelBody": {
      "oneOf": [
        { "$ref": "#/$defs/llmBodyNode" },
        { "$ref": "#/$defs/toolBodyNode" }
      ],
      "description": "fan-out 单节点模板:无 id(实例共享父 node_id)、不可 parallel(不可嵌套)。"
    },
    "itemRef": {
      "type": "string",
      "pattern": "^\\{\\{item(\\.[a-z][a-z0-9_]{0,63})?\\}\\}$",
      "description": "元素引用,仅 parallel body 语境合法(语义校验语境闸);空字段 = 整个元素。"
    },
    "llmBodyNode": {
      "type": "object",
      "additionalProperties": false,
      "required": ["type", "prompt"],
      "description": "llm fan-out 模板:镜像 llmNode 去 id(与 llmNode 的字段约束须同步改)。",
      "properties": {
        "type": { "const": "llm" },
        "retry": { "$ref": "#/$defs/retry" },
        "model": { "type": "string", "minLength": 1, "maxLength": 100 },
        "temperature": { "type": "number", "minimum": 0, "maximum": 2 },
        "max_tokens": { "type": "integer", "minimum": 1, "maximum": 200000 },
        "response_format": { "enum": ["text", "json"] },
        "prompt": { "$ref": "#/$defs/prompt" },
        "outputs": { "$ref": "#/$defs/nodeOutputs" }
      }
    },
    "toolBodyNode": {
      "type": "object",
      "additionalProperties": false,
      "required": ["type", "tool", "inputs"],
      "description": "tool fan-out 模板:镜像 toolNode 去 id(与 toolNode 的字段约束须同步改);inputs 值内 item 引用由语义扫描钉形态。",
      "properties": {
        "type": { "const": "tool" },
        "retry": { "$ref": "#/$defs/retry" },
        "tool": {
          "type": "string",
          "pattern": "^[a-z][a-z0-9_]{0,63}$",
          "description": "已注册工具名;白名单校验同 toolNode。"
        },
        "inputs": {
          "type": "object",
          "maxProperties": 64,
          "propertyNames": { "$ref": "#/$defs/notNetworkKey" },
          "additionalProperties": { "$ref": "#/$defs/toolInputValue" }
        },
        "outputs": { "$ref": "#/$defs/nodeOutputs" }
      }
    }
  }
}
