{
  "dsl": "1.0",
  "name": "approval-mode-all",
  "$comment": "合法:会签(T14.2 落地,mode=all)——全部批准才过、任一驳回即败",
  "nodes": [
    {
      "id": "boss",
      "type": "approval",
      "approvers": ["carol", "dave"],
      "mode": "all",
      "timeout_hours": 72,
      "on_timeout": "escalate"
    }
  ]
}
