{
  "dsl": "1.0",
  "name": "canvas-bare-binding",
  "metadata": {
    "canvas": {
      "nodes": {
        "decide": { "position": { "x": 40, "y": 40 } },
        "pass": { "position": { "x": 300, "y": 40 } },
        "fail": { "position": { "x": 300, "y": 180 } }
      },
      "edges": [
        { "from": "decide", "to": "pass", "source_anchor": "case_0" },
        { "from": "decide", "to": "fail" }
      ]
    }
  },
  "inputs": [{ "name": "score", "type": "number", "required": true }],
  "nodes": [
    {
      "id": "decide",
      "type": "branch",
      "cases": [{ "when": { "left": "{{inputs.score}}", "op": "gte", "right": 60 }, "next": "pass" }],
      "default": "fail"
    },
    { "id": "pass", "type": "llm", "prompt": { "template": "生成合格评语。" }, "outputs": { "text": "string" } },
    { "id": "fail", "type": "llm", "prompt": { "template": "生成补考建议。" }, "outputs": { "text": "string" } }
  ],
  "edges": [
    { "from": "decide", "to": "pass" },
    { "from": "decide", "to": "fail" }
  ],
  "outputs": { "comment": "{{nodes.pass.output.text}}" }
}
