{
  "dsl": "1.0",
  "name": "branch-demo",
  "inputs": [
    { "name": "score", "type": "number", "required": true }
  ],
  "nodes": [
    {
      "id": "decide",
      "type": "branch",
      "cases": [
        { "when": { "left": "{{inputs.score}}", "op": "gte", "right": 90 }, "next": "excellent" },
        { "when": { "left": "{{inputs.score}}", "op": "gte", "right": 60 }, "next": "pass" }
      ],
      "default": "fail"
    },
    { "id": "excellent", "type": "llm", "prompt": { "template": "生成优秀评语。" }, "outputs": { "text": "string" } },
    { "id": "pass", "type": "llm", "prompt": { "template": "生成合格评语。" }, "outputs": { "text": "string" } },
    { "id": "fail", "type": "llm", "prompt": { "template": "生成补考建议。" }, "outputs": { "text": "string" } }
  ],
  "edges": [
    { "from": "decide", "to": "excellent" },
    { "from": "decide", "to": "pass" },
    { "from": "decide", "to": "fail" }
  ],
  "outputs": { "comment": "{{nodes.pass.output.text}}" }
}
